{
  "$schema": "http://json-schema.org/draft-07/schema#",
  "$id": "AutomaticAlarmAnalysisCommandV1",
  "additionalProperties": false,
  "properties": {
    "alarmEvent": {
      "additionalProperties": false,
      "properties": {
        "alarmId": {
          "format": "uuid",
          "type": "string"
        },
        "alarmName": {
          "minLength": 1,
          "type": "string"
        },
        "awsAccountId": {
          "minLength": 1,
          "type": "string"
        },
        "awsRegion": {
          "minLength": 1,
          "type": "string"
        },
        "environmentId": {
          "format": "uuid",
          "type": "string"
        },
        "firedAt": {
          "format": "date-time",
          "type": "string"
        },
        "id": {
          "format": "uuid",
          "type": "string"
        },
        "productId": {
          "format": "uuid",
          "type": "string"
        }
      },
      "required": [
        "id",
        "productId",
        "environmentId",
        "alarmId",
        "alarmName",
        "firedAt",
        "awsAccountId",
        "awsRegion"
      ],
      "type": "object"
    },
    "executionId": {
      "format": "uuid",
      "type": "string"
    },
    "runbook": {
      "additionalProperties": false,
      "properties": {
        "catalogRevision": {
          "minLength": 1,
          "type": "string"
        },
        "definitionDigest": {
          "pattern": "^sha256[-:][0-9a-fA-F]{32,}$",
          "type": "string"
        },
        "key": {
          "minLength": 1,
          "type": "string"
        },
        "version": {
          "minLength": 1,
          "type": "string"
        },
        "workerRevision": {
          "minLength": 1,
          "type": "string"
        }
      },
      "required": [
        "key",
        "version",
        "definitionDigest",
        "catalogRevision",
        "workerRevision"
      ],
      "type": "object"
    },
    "schemaVersion": {
      "const": "1.0.0",
      "type": "string"
    },
    "trigger": {
      "additionalProperties": false,
      "properties": {
        "actorId": {
          "minLength": 1,
          "type": "string"
        },
        "kind": {
          "anyOf": [
            {
              "const": "SLACK_INGESTOR",
              "type": "string"
            },
            {
              "const": "WATCHTOWER_UI",
              "type": "string"
            },
            {
              "const": "WATCHTOWER_API",
              "type": "string"
            },
            {
              "const": "RETRY",
              "type": "string"
            },
            {
              "const": "WATCHTOWER_CLI",
              "type": "string"
            }
          ]
        },
        "parentExecutionId": {
          "format": "uuid",
          "type": "string"
        }
      },
      "required": [
        "kind"
      ],
      "type": "object"
    }
  },
  "required": [
    "schemaVersion",
    "executionId",
    "alarmEvent",
    "runbook",
    "trigger"
  ],
  "type": "object"
}
